{
  "lead_id": "demo-lead-001",
  "source_ref": {
    "source_id": "synthetic-mail",
    "object_id": "demo-001",
    "locator": "synthetic://demo-001/body",
    "retrieved_at": "2026-10-13T17:00:00Z"
  },
  "received_at": "2026-10-13T16:50:00Z",
  "classification": "request",
  "review_status": "needs_review",
  "customer": {
    "name": "Демонстрационный клиент",
    "contact": null
  },
  "request": {
    "description": "Запрос на изготовление изделия",
    "quantity": 1000,
    "unit": "шт",
    "deadline": null
  },
  "uncertainties": [
    "Контакт и срок отсутствуют в демонстрационном письме."
  ],
  "field_provenance": [
    {
      "field": "request.quantity",
      "locator": "synthetic://demo-001/body",
      "quote": "Нужны 1000 штук."
    }
  ]
}
